{"blocking_policy":"all_sources_successful","collection_output_relative_root":"pipelines/brisbane_baylands/task_06_recovery_v1/06g/replay_v35/document_publications","collection_production_id":"cprodv1-0000000000000000000000000000000000000000000000000000000000000000","collection_production_identity_ref":{"authority":"artifact_root","byte_size":0,"path":"pipelines/brisbane_baylands/task_06_recovery_v1/06g/replay_v35/resolved_specs_v1/00_initial/collection_production_identity.json","sha256":"0000000000000000000000000000000000000000000000000000000000000000"},"document_evidence_mode":"imported_downstream_selection","imported_document_production_identity_ref":{"authority":"document_input_root","byte_size":66470,"path":"resolved_specs_v1/00_initial/production_identity.json","sha256":"0a14917913aa734c3f67e7aa42fc155bf5b7f7052ac7d14bd668558a1b42442f"},"imported_document_root_relative_path":"pipelines/brisbane_baylands/task_06_recovery_v1/06g/replay_v32","imported_document_run_spec_ref":{"authority":"document_input_root","byte_size":28176,"path":"resolved_specs_v1/00_initial/task06g_document_v1.json","sha256":"dc7c32533192d8d503cc54618b0dbc04d0ed67d0a755e1f178e25b794402b4f1"},"imported_selection_ref":{"authority":"artifact_root","byte_size":104390,"path":"pipelines/brisbane_baylands/task_06_recovery_v1/06g/replay_v35/resolved_specs_v1/00_initial/task06g_imported_document_selection_v1.json","sha256":"b6d0ae7b199eaef8bcc69134de83f7313b2283b5eeadcedea4f40b0dd76e7d0d"},"ordering_policy_version":"record_target_order_v2","resolution_policy_sha256":"95804a823684792d18467534c2e09f4b0d283bd3405933e9f85515860f692186","schema_version":"er_commons.collection_run_spec.v4","source_family_catalog_relative_path":"pipelines/brisbane_baylands/task_06_recovery_v1/06g/replay_v32/inputs/task06g_source_family_catalog_v1.json","source_ids":["deir_appendix_k4","deir_appendix_n1","deir_appendix_k5","deir_appendix_n2","deir_appendix_f2","deir_appendix_k6","deir_appendix_m3","deir_appendix_l","deir_appendix_o","feir_appendix_f1","deir_appendix_c","deir_appendix_j","deir_appendix_p","deir_appendix_m1","deir_appendix_b","deir_appendix_d","deir_appendix_e","deir_appendix_a","deir_appendix_k1_part_1_of_4","deir_appendix_m2","deir_appendix_k2_part_2_of_5","deir_appendix_k3","deir_appendix_k1_part_2_of_4","deir_appendix_k2_part_1_of_5","deir_main","deir_appendix_k2_part_5_of_5","deir_appendix_i","deir_appendix_g1","deir_appendix_k1_part_4_of_4","deir_appendix_h","deir_appendix_k1_part_3_of_4","deir_appendix_g2","deir_appendix_k2_part_4_of_5","deir_appendix_g3","deir_appendix_k2_part_3_of_5"],"source_membership":[{"logical_source_id":"deir_appendix_k4","physical_source_id":"deir_appendix_k4","substitution_relative_path":null},{"logical_source_id":"deir_appendix_n1","physical_source_id":"deir_appendix_n1","substitution_relative_path":null},{"logical_source_id":"deir_appendix_k5","physical_source_id":"deir_appendix_k5","substitution_relative_path":null},{"logical_source_id":"deir_appendix_n2","physical_source_id":"deir_appendix_n2","substitution_relative_path":null},{"logical_source_id":"deir_appendix_f2","physical_source_id":"deir_appendix_f2","substitution_relative_path":null},{"logical_source_id":"deir_appendix_k6","physical_source_id":"deir_appendix_k6","substitution_relative_path":null},{"logical_source_id":"deir_appendix_m3","physical_source_id":"deir_appendix_m3","substitution_relative_path":null},{"logical_source_id":"deir_appendix_l","physical_source_id":"deir_appendix_l","substitution_relative_path":null},{"logical_source_id":"deir_appendix_o","physical_source_id":"deir_appendix_o","substitution_relative_path":null},{"logical_source_id":"deir_appendix_f1","physical_source_id":"feir_appendix_f1","substitution_relative_path":"pipelines/brisbane_baylands/task_06_recovery_v1/06c/gate3_inputs_v1/source/records/source_manifest.json"},{"logical_source_id":"deir_appendix_c","physical_source_id":"deir_appendix_c","substitution_relative_path":null},{"logical_source_id":"deir_appendix_j","physical_source_id":"deir_appendix_j","substitution_relative_path":null},{"logical_source_id":"deir_appendix_p","physical_source_id":"deir_appendix_p","substitution_relative_path":null},{"logical_source_id":"deir_appendix_m1","physical_source_id":"deir_appendix_m1","substitution_relative_path":null},{"logical_source_id":"deir_appendix_b","physical_source_id":"deir_appendix_b","substitution_relative_path":null},{"logical_source_id":"deir_appendix_d","physical_source_id":"deir_appendix_d","substitution_relative_path":null},{"logical_source_id":"deir_appendix_e","physical_source_id":"deir_appendix_e","substitution_relative_path":null},{"logical_source_id":"deir_appendix_a","physical_source_id":"deir_appendix_a","substitution_relative_path":null},{"logical_source_id":"deir_appendix_k1_part_1_of_4","physical_source_id":"deir_appendix_k1_part_1_of_4","substitution_relative_path":null},{"logical_source_id":"deir_appendix_m2","physical_source_id":"deir_appendix_m2","substitution_relative_path":null},{"logical_source_id":"deir_appendix_k2_part_2_of_5","physical_source_id":"deir_appendix_k2_part_2_of_5","substitution_relative_path":null},{"logical_source_id":"deir_appendix_k3","physical_source_id":"deir_appendix_k3","substitution_relative_path":null},{"logical_source_id":"deir_appendix_k1_part_2_of_4","physical_source_id":"deir_appendix_k1_part_2_of_4","substitution_relative_path":null},{"logical_source_id":"deir_appendix_k2_part_1_of_5","physical_source_id":"deir_appendix_k2_part_1_of_5","substitution_relative_path":null},{"logical_source_id":"deir_main","physical_source_id":"deir_main","substitution_relative_path":null},{"logical_source_id":"deir_appendix_k2_part_5_of_5","physical_source_id":"deir_appendix_k2_part_5_of_5","substitution_relative_path":null},{"logical_source_id":"deir_appendix_i","physical_source_id":"deir_appendix_i","substitution_relative_path":null},{"logical_source_id":"deir_appendix_g1","physical_source_id":"deir_appendix_g1","substitution_relative_path":null},{"logical_source_id":"deir_appendix_k1_part_4_of_4","physical_source_id":"deir_appendix_k1_part_4_of_4","substitution_relative_path":null},{"logical_source_id":"deir_appendix_h","physical_source_id":"deir_appendix_h","substitution_relative_path":null},{"logical_source_id":"deir_appendix_k1_part_3_of_4","physical_source_id":"deir_appendix_k1_part_3_of_4","substitution_relative_path":null},{"logical_source_id":"deir_appendix_g2","physical_source_id":"deir_appendix_g2","substitution_relative_path":null},{"logical_source_id":"deir_appendix_k2_part_4_of_5","physical_source_id":"deir_appendix_k2_part_4_of_5","substitution_relative_path":null},{"logical_source_id":"deir_appendix_g3","physical_source_id":"deir_appendix_g3","substitution_relative_path":null},{"logical_source_id":"deir_appendix_k2_part_3_of_5","physical_source_id":"deir_appendix_k2_part_3_of_5","substitution_relative_path":null}],"target_policy_sha256":"981b4ff1783286bacaa7cdfa5d10c38920e1575e573757a869e85bf57a241f81"}
